{
  "id": "n06",
  "date": "2026-03-22",
  "type": "product_update",
  "title": "CMEMS introduces higher-resolution coastal ocean products",
  "summary": "The Copernicus Marine Service has expanded its coastal product portfolio, improving resolution for currents, waves and biogeochemistry.",
  "body": "New and upgraded CMEMS coastal products offer finer spatial resolution for near-shore currents, waves and water quality. These support maritime route optimisation, port operations, aquaculture management and monitoring at the interface with inland waterways.",
  "link": "https://marine.copernicus.eu",
  "classification": {
    "market_segments": [
      "transport.maritime"
    ]
  },
  "tags": []
}
